[
  {
    "titulo": "Create Your First Gemini Enterprise Application",
    "img": "https://cdn.qwiklabs.com/%2FoLo60xg2CMZB%2BWs7JLFlQhAVVn7ZXEVsiHws3APcHY%3D",
    "fecha": "2026-05-10",
    "url": "https://www.skills.google/public_profiles/36fdb0e1-891c-4dc5-aef1-d89aecc3dd45/badges/24072215",
    "desc": "Aprende los pasos esenciales para desarrollar tu primera aplicación utilizando Gemini Enterprise, enfocándote en la integración y la funcionalidad básica.",
    "desc_en": "Learn the essential steps to develop your first application using Gemini Enterprise, focusing on integration and basic functionality."
  },
  {
    "titulo": "Enterprise Agents and Use Cases",
    "img": "https://cdn.qwiklabs.com/e%2B%2FPYFSmVhRO03c6pLQZCCkY3jQsoBbI32sIHScUeuY%3D",
    "fecha": "2026-05-09",
    "url": "https://www.skills.google/public_profiles/36fdb0e1-891c-4dc5-aef1-d89aecc3dd45/badges/24062721",
    "desc": "Explora cómo las empresas pueden implementar agentes de IA avanzados y sus casos de uso prácticos para optimizar operaciones y mejorar la experiencia del cliente.",
    "desc_en": "Explore how enterprises can implement advanced AI agents and their practical use cases to optimize operations and enhance customer experience."
  },
  {
    "titulo": "Agent Fundamentals",
    "img": "https://cdn.qwiklabs.com/d7fgl5Am8p0NbqK9QhS4%2FDYPRBDMSwU6392ifq0p7UY%3D",
    "fecha": "2026-05-06",
    "url": "https://www.skills.google/public_profiles/36fdb0e1-891c-4dc5-aef1-d89aecc3dd45/badges/23994115",
    "desc": "Comprende los principios fundamentales para la construcción y gestión de agentes de IA, cubriendo los componentes clave y las mejores prácticas.",
    "desc_en": "Understand the fundamental principles for building and managing AI agents, covering key components and best practices."
  },
  {
    "titulo": "Introduction to AI Agents",
    "img": "https://cdn.qwiklabs.com/7xFCpXl6c41wp0LLllrB7TUvpcYBIcfIbPMjsKESjGQ%3D",
    "fecha": "2026-05-03",
    "url": "https://www.skills.google/public_profiles/36fdb0e1-891c-4dc5-aef1-d89aecc3dd45/badges/23947226",
    "desc": "Este badge introduce los conceptos fundamentales de los agentes de IA, su arquitectura y cómo se pueden utilizar para automatizar tareas y mejorar la interacción.",
    "desc_en": "This badge introduces the fundamental concepts of AI agents, their architecture, and how they can be used to automate tasks and enhance interaction."
  },
  {
    "titulo": "Service Orchestration and Choreography on Google Cloud",
    "img": "https://cdn.qwiklabs.com/qBbNJUPr0qCV%2B3VL9T3h2ok9%2B5cknOVMpBXpfodHcss%3D",
    "fecha": "2026-04-21",
    "url": "https://www.skills.google/public_profiles/36fdb0e1-891c-4dc5-aef1-d89aecc3dd45/badges/23721886",
    "desc": "Aprende a diseñar y construir flujos de trabajo resilientes y escalables utilizando servicios de orquestación y coreografía en Google Cloud, como Cloud Composer y Cloud Workflows.",
    "desc_en": "Learn to design and build resilient and scalable workflows using orchestration and choreography services on Google Cloud, such as Cloud Composer and Cloud Workflows."
  },
  {
    "titulo": "Developing Applications with Google Cloud: Foundations",
    "img": "https://cdn.qwiklabs.com/A6pBAbPUDcs6%2B%2Bf7PAI%2FIuL2OzCzj3FFJIcXICIe9EE%3D",
    "fecha": "2026-04-17",
    "url": "https://www.skills.google/public_profiles/36fdb0e1-891c-4dc5-aef1-d89aecc3dd45/badges/23664936",
    "desc": "Este badge valida la capacidad de desarrollar e implementar aplicaciones en Google Cloud, cubriendo desde los servicios fundamentales hasta las prácticas recomendadas de desarrollo.",
    "desc_en": "This badge validates the ability to develop and deploy applications on Google Cloud, covering fundamental services and development best practices."
  }
]
